Abbreviation,Name,Chair,Representative_id,URL,Chamber
JCSE,Commission on Security and Cooperation in Europe,Alcee L. Hastings,150,http://www.csce.giv,Joint
JSPR,Joint Committee on Printing,none,,https://cha.house.gov/jointcommittees/joint-committee-on-printing,Joint
JSTX,Joint Committee on Taxation,none,,https://www.jct.gov,Joint
JSLC,Joint Committee on the Library,none,,https://cha.house.gov/jointcommittees/joint-committee-library,Joint
JSEC,Joint Economic Committee,none,,https://www.jec.senate.gov/public/,Joint